{
  "schema_version": 1,
  "task_id": "A-02",
  "round": 1,
  "reviewer": "claude-code",
  "reviewed_commit": "d8c6c4ee84d17c3e08d3792f5a14e6329fc705b8",
  "pr_url": "https://github.com/agentstudiots-boop/affiliate-reel-agent/pull/81",
  "verdict": "approve",
  "checklist": {
    "architecture": "ok",
    "approval_invariants": "ok",
    "security": "ok",
    "error_handling": "n/a",
    "costs": "ok",
    "database": "ok",
    "tests": "ok",
    "integration": "ok",
    "tech_debt": "issue",
    "honest_status": "ok"
  },
  "findings": [
    {
      "id": "CC-A02-01",
      "severity": "minor",
      "file": "docs/ai-business/09_GPT_ARCHITEKTURPRUEFUNG.md",
      "line": null,
      "summary": "§K Schritt 4 schlägt den Koordinations-Validator C-02 als ersten Code-Baustein vor. Abweichende Empfehlung: fachlicher Baustein B-01 ∥ E-05 zuerst, Validator erst bei nachgewiesenem Engpass (Betreiberauftrag 18.10.: Koordination nicht zum Hauptprojekt machen).",
      "failure_scenario": "Erste Entwicklungsrunden gehen in Koordinationswerkzeuge statt in das KI-Unternehmen.",
      "status": "open",
      "resolution": "Zur Entscheidung als ADR-16 in 07 vorgelegt."
    },
    {
      "id": "CC-A02-02",
      "severity": "nit",
      "file": "docs/ai-business/coordination/tasks/A-02/task.json",
      "line": null,
      "summary": "tests[0]/[2] nennen commit 025fd88, obwohl laut detail vor diesem Commit am Arbeitsbaum geprüft wurde. Inhaltlich transparent, Feldsemantik aber uneindeutig.",
      "failure_scenario": "Leser hält 025fd88 für den geprüften Stand.",
      "status": "open",
      "resolution": "Künftig commit = letzter existierender Stand (05 §8.3, Runde 2)."
    },
    {
      "id": "CC-A02-03",
      "severity": "nit",
      "file": "docs/ai-business/coordination/resources.json",
      "line": null,
      "summary": "revision springt von 1 auf 3; zusätzlich wurde der Claude-Abschnitt umformatiert (inhaltlich unverändert).",
      "failure_scenario": "Revision als Konflikterkennung wird unzuverlässig; fremder Abschnitt geändert.",
      "status": "open",
      "resolution": "Regel ergänzt: jedes System pflegt nur systems.<eigene id>; revision +1 je Commit."
    },
    {
      "id": "CC-A02-04",
      "severity": "nit",
      "file": "docs/ai-business/coordination/tasks/A-01/review-1.json",
      "line": null,
      "summary": "pr_url null, obwohl das Review über PR #81 geliefert wurde; Befundtexte doppelt in 09 und review-1.json.",
      "failure_scenario": "Doppelte Pflege bei Folgerunden.",
      "status": "open",
      "resolution": "Für Runde 2: Befunde nur in review-<n>.json, Bericht verweist darauf."
    }
  ],
  "tests_run": [
    "Alle 4 geänderten Dateien des PR-Diffs gelesen; Aussagen gegen origin/main c56711e geprüft: vercel.json 12 Cron-Einträge, Migration 038 registriert, lib/content/orchestrator.ts:172/:217 KI-Urteile, lib/observability/model-calls.ts:38 verschluckt Speicherfehler, PR #74–#81 alle von agentstudiots-boop",
    "python3 jsonschema Draft202012Validator: A-01/review-1.json, A-02/task.json gültig gegen Schema Revision 2",
    "Vercel-Doku-Quellen S1–S4 nicht erneut abgerufen"
  ],
  "created_at": "2026-10-18T21:30:00Z"
}
